{
  "agent_id": "repo-maintainer",
  "capability_drift": 1,
  "evaluations": [
    {
      "decision": "BLOCK",
      "event_id": "evt-file-write-001",
      "finding_id": "finding:evt-file-write-001:capability-drift",
      "outcome": "DRIFT"
    }
  ],
  "events_observed": 1,
  "findings": [
    {
      "capability": "FILESYSTEM_WRITE",
      "decision": "BLOCK",
      "declared": false,
      "event_id": "evt-file-write-001",
      "finding_id": "finding:evt-file-write-001:capability-drift",
      "reason": "NO_MATCHING_ALLOW_RULE",
      "run_id": "run-file-write-drift",
      "schema_version": "0.1",
      "severity": "HIGH",
      "target": {
        "kind": "path",
        "path": "C:/Windows/System32/drivers/etc/hosts"
      },
      "type": "CAPABILITY_DRIFT"
    }
  ],
  "matched_policy": 0,
  "overall_decision": "BLOCK",
  "policy_id": "repo-maintainer-v1",
  "run_id": "run-file-write-drift",
  "schema_version": "0.1"
}
