{
  "agent_id": "repo-maintainer",
  "capability_drift": 2,
  "evaluations": [
    {
      "decision": "ALLOW",
      "event_id": "evt-credential-001",
      "matched_rule_id": "read-src",
      "outcome": "ALLOWED"
    },
    {
      "decision": "TERMINATE",
      "event_id": "evt-credential-002",
      "finding_id": "finding:evt-credential-002:capability-drift",
      "outcome": "DRIFT"
    },
    {
      "decision": "BLOCK",
      "event_id": "evt-credential-003",
      "finding_id": "finding:evt-credential-003:capability-drift",
      "outcome": "DRIFT"
    }
  ],
  "events_observed": 3,
  "findings": [
    {
      "capability": "CREDENTIAL_READ",
      "decision": "TERMINATE",
      "declared": false,
      "event_id": "evt-credential-002",
      "finding_id": "finding:evt-credential-002:capability-drift",
      "reason": "NO_MATCHING_ALLOW_RULE",
      "run_id": "run-credential-drift",
      "schema_version": "0.1",
      "severity": "CRITICAL",
      "target": {
        "kind": "credential",
        "name": "NPM_TOKEN",
        "provider": "environment"
      },
      "type": "CAPABILITY_DRIFT"
    },
    {
      "capability": "NETWORK_EGRESS",
      "decision": "BLOCK",
      "declared": false,
      "event_id": "evt-credential-003",
      "finding_id": "finding:evt-credential-003:capability-drift",
      "reason": "NO_MATCHING_ALLOW_RULE",
      "run_id": "run-credential-drift",
      "schema_version": "0.1",
      "severity": "HIGH",
      "target": {
        "host": "registry.npmjs.org",
        "kind": "network_origin",
        "port": 443,
        "scheme": "https"
      },
      "type": "CAPABILITY_DRIFT"
    }
  ],
  "matched_policy": 1,
  "overall_decision": "TERMINATE",
  "policy_id": "repo-maintainer-v1",
  "run_id": "run-credential-drift",
  "schema_version": "0.1"
}
