{
  "agent_id": "repo-maintainer",
  "capability_drift": 1,
  "evaluations": [
    {
      "decision": "BLOCK",
      "event_id": "evt-network-001",
      "finding_id": "finding:evt-network-001:capability-drift",
      "outcome": "DRIFT"
    }
  ],
  "events_observed": 1,
  "findings": [
    {
      "capability": "NETWORK_EGRESS",
      "decision": "BLOCK",
      "declared": false,
      "event_id": "evt-network-001",
      "finding_id": "finding:evt-network-001:capability-drift",
      "reason": "NO_MATCHING_ALLOW_RULE",
      "run_id": "run-network-drift",
      "schema_version": "0.1",
      "severity": "HIGH",
      "target": {
        "host": "registry.npmjs.org",
        "kind": "network_origin",
        "port": 443,
        "scheme": "https"
      },
      "type": "CAPABILITY_DRIFT"
    }
  ],
  "matched_policy": 0,
  "overall_decision": "BLOCK",
  "policy_id": "repo-maintainer-v1",
  "run_id": "run-network-drift",
  "schema_version": "0.1"
}
